{
  "$schema": "https://json-schema.org/draft/2020-12/schema",
  "$id": "https://example.org/china-dashboard/facilities.schema.json",
  "title": "Data-center inventory (province level, no locations)",
  "type": "object",
  "required": ["generated", "note", "sourceCounts", "facilities"],
  "additionalProperties": false,
  "properties": {
    "generated": { "type": "string", "format": "date" },
    "note": { "type": "string" },
    "sourceCounts": { "type": "object", "additionalProperties": { "type": "integer", "minimum": 0 } },
    "facilities": {
      "type": "array",
      "items": {
        "type": "object",
        "required": ["id", "name", "operator", "province", "status", "facilityType", "mw", "capacity", "pue", "onlineYear", "sources"],
        "additionalProperties": false,
        "properties": {
          "id": { "type": "string", "pattern": "^dc_[0-9a-f]{10}$" },
          "name": { "type": "string", "minLength": 1 },
          "operator": { "type": ["string", "null"] },
          "province": { "type": "string", "pattern": "^[a-z_]+$" },
          "status": { "enum": ["Operating", "Development", "Proposed", "Unknown"] },
          "facilityType": { "type": "string", "minLength": 1 },
          "mw": { "type": ["number", "null"], "minimum": 0 },
          "capacity": { "enum": ["Mega campus (1,000+ MW)", "Hyperscale (100–999 MW)", "Large (51–99 MW)", "Medium (11–50 MW)", "Small (0–10 MW)", "Unknown"] },
          "pue": { "type": ["number", "null"], "minimum": 1, "maximum": 3 },
          "onlineYear": { "type": ["integer", "null"], "minimum": 1990, "maximum": 2040 },
          "sources": { "type": "array", "minItems": 1, "items": { "enum": ["dcm", "baxtel", "dckb", "dhi_hyperscale", "dhi_western", "dccom"] } }
        }
      }
    }
  }
}
