{"generated":"2026-10-12","note":"Province-level inventory. Coordinates, addresses, cities and profile links are intentionally absent.","sourceCounts":{"dcm":459,"dhi_hyperscale":36,"dckb":11,"baxtel":101,"dhi_western":44},"facilities":[{"id":"dc_b8895e4b3d","name":"China Telecom Big Data Industrial Park","operator":"China Telecom Global Ltd","province":"anhui","status":"Operating","facilityType":"Colocation","mw":null,"capacity":"Unknown","pue":null,"onlineYear":null,"sources":["dcm"]},{"id":"dc_99d05e1612","name":"China Telecom Hefei IDC","operator":"China Telecom Global Ltd","province":"anhui","status":"Operating","facilityType":"Colocation","mw":null,"capacity":"Unknown","pue":null,"onlineYear":null,"sources":["dcm"]},{"id":"dc_698fc69e6c","name":"China Telecom Tiandu Road","operator":"China Telecom Global Ltd","province":"anhui","status":"Operating","facilityType":"Colocation","mw":null,"capacity":"Unknown","pue":null,"onlineYear":null,"sources":["dcm"]},{"id":"dc_1d0a8f1b39","name":"China Telecom Tongling IDC","operator":"China Telecom Global Ltd","province":"anhui","status":"Operating","facilityType":"Colocation","mw":null,"capacity":"Unknown","pue":null,"onlineYear":null,"sources":["dcm"]},{"id":"dc_33a76a7952","name":"China Telecom Wuhu","operator":"China Telecom Global Ltd","province":"anhui","status":"Operating","facilityType":"Colocation","mw":null,"capacity":"Unknown","pue":null,"onlineYear":null,"sources":["dcm"]},{"id":"dc_1dd956f205","name":"China Telecom Wuhu IDC","operator":"China Telecom Global Ltd","province":"anhui","status":"Operating","facilityType":"Colocation","mw":null,"capacity":"Unknown","pue":null,"onlineYear":null,"sources":["dcm"]},{"id":"dc_617b32e9ac","name":"Huawei Wuhu-Jiangbei","operator":"Huawei","province":"anhui","status":"Operating","facilityType":"Hyperscale","mw":null,"capacity":"Unknown","pue":null,"onlineYear":null,"sources":["dcm","dhi_hyperscale"]},{"id":"dc_ae382a1104","name":"Huawei Wuhu-Sanshan","operator":"Huawei","province":"anhui","status":"Operating","facilityType":"Hyperscale","mw":null,"capacity":"Unknown","pue":null,"onlineYear":null,"sources":["dcm","dhi_hyperscale"]},{"id":"dc_4158ea7b6e","name":"Huawei Wuhu-Zhijiao","operator":"Huawei","province":"anhui","status":"Operating","facilityType":"Hyperscale","mw":null,"capacity":"Unknown","pue":null,"onlineYear":null,"sources":["dcm"]},{"id":"dc_bea9a37fbc","name":"Huayun Xinchuang Cloud Data Center","operator":"Huayun Data Holdings Group","province":"anhui","status":"Operating","facilityType":"Colocation","mw":null,"capacity":"Unknown","pue":null,"onlineYear":null,"sources":["dcm"]},{"id":"dc_5535b7090b","name":"VNET Anhui (Suzhou)","operator":"VNET Group, Inc.","province":"anhui","status":"Operating","facilityType":"Colocation","mw":null,"capacity":"Unknown","pue":null,"onlineYear":null,"sources":["dcm"]},{"id":"dc_5c91359f89","name":"Wuhu Phase 3-6","operator":null,"province":"anhui","status":"Proposed","facilityType":"Unknown","mw":null,"capacity":"Unknown","pue":null,"onlineYear":null,"sources":["dckb"]},{"id":"dc_562284ac29","name":"Atecsys Data Center","operator":"Chinacache North America","province":"beijing","status":"Operating","facilityType":"Colocation","mw":null,"capacity":"Unknown","pue":null,"onlineYear":2015,"sources":["dcm"]},{"id":"dc_19c8d774ba","name":"Beijing Yizhuang Cloud Base","operator":"Cloud Valley","province":"beijing","status":"Operating","facilityType":"Colocation","mw":null,"capacity":"Unknown","pue":null,"onlineYear":null,"sources":["dcm"]},{"id":"dc_2d45d8e2e4","name":"CERNET Beijing","operator":"CERNET","province":"beijing","status":"Operating","facilityType":"Colocation","mw":1.44,"capacity":"Small (0–10 MW)","pue":null,"onlineYear":null,"sources":["baxtel","dckb","dcm"]},{"id":"dc_b805e1ed7d","name":"CapitaLand Zidane 02 Data Centre","operator":"CapitaLand Data Centre","province":"beijing","status":"Proposed","facilityType":"Colocation","mw":45.0,"capacity":"Medium (11–50 MW)","pue":null,"onlineYear":null,"sources":["dcm"]},{"id":"dc_635ed9141f","name":"China Mobile Beijing","operator":"China Mobile Limited","province":"beijing","status":"Operating","facilityType":"Colocation","mw":null,"capacity":"Unknown","pue":null,"onlineYear":null,"sources":["dcm"]},{"id":"dc_e095c8a663","name":"China Telecom Beijing","operator":"China Telecom Global Ltd","province":"beijing","status":"Operating","facilityType":"Colocation","mw":null,"capacity":"Unknown","pue":null,"onlineYear":null,"sources":["dcm"]},{"id":"dc_92a29fcf96","name":"China Unicom Beijing","operator":"China Unicom","province":"beijing","status":"Operating","facilityType":"Colocation","mw":null,"capacity":"Unknown","pue":null,"onlineYear":null,"sources":["dcm"]},{"id":"dc_b5ecc863a4","name":"Chindata Group Beijing (Chaoyang)","operator":"Chindata","province":"beijing","status":"Operating","facilityType":"Colocation","mw":null,"capacity":"Unknown","pue":null,"onlineYear":null,"sources":["dcm"]},{"id":"dc_b8fa4be690","name":"DYXnet Beijing (Oriental Plaza)","operator":"Diyixian.com Limited","province":"beijing","status":"Operating","facilityType":"Colocation","mw":null,"capacity":"Unknown","pue":null,"onlineYear":null,"sources":["dcm"]},{"id":"dc_3dd19ec8b9","name":"Digital Edge - Beijing PEK1","operator":"Digital Edge DC","province":"beijing","status":"Operating","facilityType":"Colocation","mw":7.8,"capacity":"Small (0–10 MW)","pue":1.45,"onlineYear":null,"sources":["dcm"]},{"id":"dc_dc1c712109","name":"GDS Beijing Data Center (BJ1)","operator":"GDS","province":"beijing","status":"Operating","facilityType":"Colocation","mw":null,"capacity":"Unknown","pue":null,"onlineYear":2015,"sources":["dcm"]},{"id":"dc_f0a511a056","name":"GDS Beijing Data Center (BJ10)","operator":"GDS","province":"beijing","status":"Operating","facilityType":"Colocation","mw":null,"capacity":"Unknown","pue":null,"onlineYear":2020,"sources":["dcm"]},{"id":"dc_2d667256a7","name":"GDS Beijing Data Center (BJ11)","operator":"GDS","province":"beijing","status":"Operating","facilityType":"Colocation","mw":null,"capacity":"Unknown","pue":null,"onlineYear":2020,"sources":["dcm"]},{"id":"dc_280d8ad293","name":"GDS Beijing Data Center (BJ12)","operator":"GDS","province":"beijing","status":"Operating","facilityType":"Colocation","mw":11.3,"capacity":"Medium (11–50 MW)","pue":null,"onlineYear":2020,"sources":["dcm"]},{"id":"dc_b0d9ea34be","name":"GDS Beijing Data Center (BJ13)","operator":"GDS","province":"beijing","status":"Operating","facilityType":"Colocation","mw":null,"capacity":"Unknown","pue":null,"onlineYear":2022,"sources":["dcm"]},{"id":"dc_f7adbe58ff","name":"GDS Beijing Data Center (BJ14)","operator":"GDS","province":"beijing","status":"Operating","facilityType":"Colocation","mw":null,"capacity":"Unknown","pue":null,"onlineYear":2023,"sources":["dcm"]},{"id":"dc_db1a224811","name":"GDS Beijing Data Center (BJ15)","operator":"GDS","province":"beijing","status":"Operating","facilityType":"Colocation","mw":null,"capacity":"Unknown","pue":null,"onlineYear":2021,"sources":["dcm"]},{"id":"dc_877602b4a0","name":"GDS Beijing Data Center (BJ16)","operator":"GDS","province":"beijing","status":"Operating","facilityType":"Colocation","mw":null,"capacity":"Unknown","pue":null,"onlineYear":2021,"sources":["dcm"]},{"id":"dc_31540fe023","name":"GDS Beijing Data Center (BJ2)","operator":"GDS","province":"beijing","status":"Operating","facilityType":"Colocation","mw":null,"capacity":"Unknown","pue":null,"onlineYear":2017,"sources":["dcm"]},{"id":"dc_16a1c5a001","name":"GDS Beijing Data Center (BJ3)","operator":"GDS","province":"beijing","status":"Operating","facilityType":"Colocation","mw":null,"capacity":"Unknown","pue":null,"onlineYear":2017,"sources":["dcm"]},{"id":"dc_435c8338de","name":"GDS Beijing Data Center (BJ4)","operator":"GDS","province":"beijing","status":"Operating","facilityType":"Colocation","mw":null,"capacity":"Unknown","pue":null,"onlineYear":2019,"sources":["dcm"]},{"id":"dc_f1b617a0f2","name":"GDS Beijing Data Center (BJ5)","operator":"GDS","province":"beijing","status":"Operating","facilityType":"Colocation","mw":null,"capacity":"Unknown","pue":null,"onlineYear":2019,"sources":["dcm"]},{"id":"dc_5f56497e11","name":"GDS Beijing Data Center (BJ6)","operator":"GDS","province":"beijing","status":"Operating","facilityType":"Colocation","mw":null,"capacity":"Unknown","pue":null,"onlineYear":2019,"sources":["dcm"]},{"id":"dc_0059a78660","name":"GDS Beijing Data Center (BJ7)","operator":"GDS","province":"beijing","status":"Operating","facilityType":"Colocation","mw":null,"capacity":"Unknown","pue":null,"onlineYear":2020,"sources":["dcm"]},{"id":"dc_f58952c5e0","name":"GDS Beijing Data Center (BJ8)","operator":"GDS","province":"beijing","status":"Operating","facilityType":"Colocation","mw":null,"capacity":"Unknown","pue":null,"onlineYear":2021,"sources":["dcm"]},{"id":"dc_ad8339161f","name":"GDS Beijing Data Center (BJ9)","operator":"GDS","province":"beijing","status":"Operating","facilityType":"Colocation","mw":null,"capacity":"Unknown","pue":null,"onlineYear":2019,"sources":["dcm"]},{"id":"dc_23de404a7a","name":"GDS Tianjin Data Center (TJ1)","operator":"GDS","province":"beijing","status":"Operating","facilityType":"Colocation","mw":null,"capacity":"Unknown","pue":null,"onlineYear":2021,"sources":["dcm"]},{"id":"dc_a7e25a94e4","name":"IXTech Beijing IDC-1","operator":"IXTech Limited","province":"beijing","status":"Operating","facilityType":"Colocation","mw":null,"capacity":"Unknown","pue":null,"onlineYear":null,"sources":["dcm"]},{"id":"dc_d7c0081ac5","name":"Princeton Digital BJ1","operator":"Princeton Digital Group","province":"beijing","status":"Operating","facilityType":"Colocation","mw":50.0,"capacity":"Medium (11–50 MW)","pue":null,"onlineYear":2017,"sources":["baxtel","dcm"]},{"id":"dc_4f5d87127d","name":"Sino-Ocean Beijing Majuqiao","operator":"Sino-Ocean Data","province":"beijing","status":"Operating","facilityType":"Colocation","mw":20.0,"capa